{
  "contract_version": "1.0.0",
  "series_id": "七龙珠",
  "conversation_id": "conv_demo_001",
  "stage": "s3_episode_done",
  "default_workflow": "selfhost/video_minimax_h3_r2v_fast.json",
  "aspect": "9:16",
  "context_ir": "off",
  "last_completed_episode": "EP001",
  "next_episode": "EP002",
  "active_job_ids": [],
  "enrich_jobs": [],
  "episodes": {
    "EP001": {
      "status": "done",
      "workflow": "selfhost/video_minimax_h3_r2v_fast.json",
      "master_path": "templates/七龙珠/output/EP001/master.mp4",
      "jsonl_path": "templates/七龙珠/run/EP001.episode-run.jsonl",
      "resume_from_shot": null,
      "accepted_shots": [],
      "locked_shots": [],
      "failed_shots": []
    }
  },
  "s1_gate": {
    "literary_accepted": true,
    "cast_leads_accepted": true,
    "audio_status": "deferred",
    "ready_for_s2": true
  },
  "deliveries": [],
  "updated_at": "2026-09-20T07:10:00+00:00"
}
